{"id":"FIXTURE-PRE-NATIVE-WINDOWS","kind":"native_windows","source":{"repository":"nextain/naia-adk","revision":"pre-recovery","locator":"AGENTS.md#Windows-native","decision":"new_gap_fixture","reason":"Make Windows support independent of WSL, Bash, and symlinks."},"scorer":{"kind":"deterministic_structural","revision":"native-platform-v1"},"input":{"platform":"windows","command":"node packages/benchmark-contract/test/validate-pre-recovery-baseline.mjs"},"oracle":{"uses_wsl":false,"uses_bash":false,"requires_symlink":false,"exit_code":0}}
