{"id":"FIXTURE-PRE-TRACE-ORPHAN","kind":"trace_orphan","source":{"repository":"nextain/naia-adk","revision":"pre-recovery","locator":".agents/progress/issue-16-trace.json#fault-injection","decision":"new_gap_fixture","reason":"Prove that an internally plausible orphan cannot pass the trace gate."},"scorer":{"kind":"deterministic_structural","revision":"trace-validator-v1"},"input":{"fault":"remove implementation-to-evidence edge","remaining_node_kind":"evidence"},"oracle":{"validator_result":"FAIL","minimum_orphans":1}}
