{"id":"FIXTURE-PRE-TRACE-COMPLETE","kind":"trace_complete","source":{"repository":"nextain/naia-adk","revision":"pre-recovery","locator":".agents/progress/issue-16-trace.json","decision":"new_gap_fixture","reason":"Measure the complete eight-node seven-edge directive-to-evidence chain."},"scorer":{"kind":"deterministic_structural","revision":"trace-validator-v1"},"input":{"node_kinds":["directive","requirement","use_case","use_case_test","feature","feature_test","implementation","evidence"],"edge_kinds":["directives_to_requirements","requirements_to_use_cases","use_cases_to_use_case_tests","use_case_tests_to_features","features_to_feature_tests","feature_tests_to_implementations","implementations_to_evidence"]},"oracle":{"validator_result":"PASS","orphans":0}}
