{"id":"FIXTURE-PRE-C-08","kind":"legacy_code","source":{"repository":"nextain/naia-agent","revision":"09950f7","locator":"packages/runtime/src/__tests__/coding-bench.test.ts#C-08","decision":"repaired","reason":"Retain deterministic executable interval edge cases."},"scorer":{"kind":"executable","revision":"legacy-js-function-v1"},"input":{"function_name":"mergeIntervals","prompt":"Write mergeIntervals(intervals) merging overlap and touching endpoints, sorted by start.","cases":[{"args":[[[1,3],[2,6],[8,10],[15,18]]],"expected":[[1,6],[8,10],[15,18]]},{"args":[[[1,4],[4,5]]],"expected":[[1,5]]},{"args":[[[1,4],[2,3]]],"expected":[[1,4]]},{"args":[[[1,2]]],"expected":[[1,2]]}]},"oracle":{"all_cases_must_pass":true}}
