{"id":"FIXTURE-PRE-REUSE-DECISION","kind":"reuse_decision","source":{"repository":"nextain/naia-adk","revision":"pre-recovery","locator":".agents/context/agents-rules.json#reuse","decision":"new_gap_fixture","reason":"Measure search and atomic reservation before implementation creation."},"scorer":{"kind":"deterministic_structural","revision":"reuse-reservation-v1"},"input":{"query_completed_at":"2026-07-29T00:00:00Z","reservation_acquired_at":"2026-07-29T00:00:01Z","decision_at":"2026-07-29T00:00:02Z","first_implementation_at":"2026-07-29T00:00:03Z","conflict_result":"clear"},"oracle":{"reuse_gate":"GREEN","duplicate_implementation_created":false}}
