{"id":"FIXTURE-PRE-STALE-MIRROR","kind":"stale_mirror","source":{"repository":"nextain/naia-adk","revision":"pre-recovery","locator":".agents/context/context-mirror-manifest.json","decision":"new_gap_fixture","reason":"Detect stale dual context without making a live translation call."},"scorer":{"kind":"deterministic_structural","revision":"dual-context-stale-v1"},"input":{"source_digest":"aaaaaaaaaaaaaaaaaaaaaaaaaaaaaaaaaaaaaaaaaaaaaaaaaaaaaaaaaaaaaaaa","accepted_source_digest":"bbbbbbbbbbbbbbbbbbbbbbbbbbbbbbbbbbbbbbbbbbbbbbbbbbbbbbbbbbbbbbbb","previous_mirror_digest":"cccccccccccccccccccccccccccccccccccccccccccccccccccccccccccccccc","live_translation_allowed":false},"oracle":{"stale":true,"accepted":false,"previous_mirror_preserved":true,"translation_attempts":0}}
