{"id":"FIXTURE-PRE-C-01","kind":"legacy_code","source":{"repository":"nextain/naia-agent","revision":"09950f7","locator":"packages/runtime/src/__tests__/coding-bench.test.ts#C-01","decision":"repaired","reason":"Retain executable cases only; remove historical aggregate scoring."},"scorer":{"kind":"executable","revision":"legacy-js-function-v1"},"input":{"function_name":"sumArray","prompt":"Write a JavaScript function sumArray(nums) that returns the sum of all elements.","cases":[{"args":[[1,2,3]],"expected":6},{"args":[[0,-1,5]],"expected":4},{"args":[[]],"expected":0},{"args":[[100]],"expected":100}]},"oracle":{"all_cases_must_pass":true}}
