{"id":"FIXTURE-PRE-C-06","kind":"legacy_code","source":{"repository":"nextain/naia-agent","revision":"09950f7","locator":"packages/runtime/src/__tests__/coding-bench.test.ts#C-06","decision":"repaired","reason":"Retain deterministic executable cases and explicit negative-only edge case."},"scorer":{"kind":"executable","revision":"legacy-js-function-v1"},"input":{"function_name":"maxSubarraySum","prompt":"Write maxSubarraySum(nums) returning the maximum sum of a contiguous non-empty subarray.","cases":[{"args":[[-2,1,-3,4,-1,2,1,-5,4]],"expected":6},{"args":[[1]],"expected":1},{"args":[[5,4,-1,7,8]],"expected":23},{"args":[[-1,-2,-3]],"expected":-1}]},"oracle":{"all_cases_must_pass":true}}
