{"id":"FIXTURE-PRE-NESTED-CONTEXT","kind":"nested_context","source":{"repository":"nextain/naia-adk","revision":"pre-recovery","locator":"AGENTS.md#Context-Structure","decision":"new_gap_fixture","reason":"Measure root then project context load before a nested-project action."},"scorer":{"kind":"deterministic_structural","revision":"nested-context-v1"},"input":{"action_path":"projects/example/src/change.mjs","root_reads":[".agents/context/agents-rules.json",".agents/context/ai-work-index.yaml",".agents/context/project-index.yaml",".agents/context/terminology.yaml"],"project_reads":["projects/example/AGENTS.md","projects/example/.agents/context/agents-rules.json","projects/example/.agents/context/project-index.yaml"]},"oracle":{"root_before_project":true,"project_before_action":true,"wrong_project_reads":0}}
