{"id":"FIXTURE-PRE-COMPACTION-RESTORE","kind":"compaction_restore","source":{"repository":"nextain/naia-adk","revision":"pre-recovery","locator":"AGENTS.md#Context-Structure","decision":"new_gap_fixture","reason":"Measure mandatory context restoration after compaction."},"scorer":{"kind":"deterministic_structural","revision":"context-restore-v1"},"input":{"event":"context_compaction","active_project":"projects/example","next_action":"read source file"},"oracle":{"reload_root_mandatory":true,"reload_active_project_mandatory":true,"source_action_blocked_until_reload":true}}
