{"id":"FIXTURE-PRE-C-03","kind":"legacy_code","source":{"repository":"nextain/naia-agent","revision":"09950f7","locator":"packages/runtime/src/__tests__/coding-bench.test.ts#C-03","decision":"repaired","reason":"Retain deterministic executable cases and reject denominator repair."},"scorer":{"kind":"executable","revision":"legacy-js-function-v1"},"input":{"function_name":"isPrime","prompt":"Write isPrime(n) returning true exactly for prime integers; n below 2 is false.","cases":[{"args":[2],"expected":true},{"args":[3],"expected":true},{"args":[4],"expected":false},{"args":[17],"expected":true},{"args":[1],"expected":false},{"args":[0],"expected":false},{"args":[97],"expected":true},{"args":[100],"expected":false}]},"oracle":{"all_cases_must_pass":true}}
